{
  "run_id": "B1_DRY_RUN_20260610T045543_RD",
  "task_file": "D:\\agent-acceptance\\_reports\\multi-agent-multi-gpt-pilot-a1\\DISPATCH_PLAN_R3.json",
  "executor_id": "bounded-dry-run-local",
  "reviewer_id": null,
  "created_at": "2026-06-10T04:55:43Z",
  "producer": "bounded_execution_dry_run.py"
}